{"capabilities":[{"area":"HEALTH","capability_id":"resolve.connection","elapsed_ms":null,"error_code":"ERR_RESOLVE_NOT_AVAILABLE","error_type":null,"fallback":"Manual Resolve launch/check","method_candidates":[],"notes":["Resolve scripting root unavailable."],"object_name":"resolve","observed_methods":[],"return_kind":"NONE","status":"PROBE_REQUIRED","studio_requirement":"UNCONFIRMED"},{"area":"HEALTH","capability_id":"resolve.version","elapsed_ms":null,"error_code":null,"error_type":null,"fallback":"Record version manually","method_candidates":["GetVersionString","GetVersion"],"notes":["Parent object unavailable; retry with an open sandbox/current Project."],"object_name":"resolve","observed_methods":[],"return_kind":null,"status":"PROBE_REQUIRED","studio_requirement":"UNCONFIRMED"},{"area":"HEALTH","capability_id":"resolve.product_name","elapsed_ms":null,"error_code":null,"error_type":null,"fallback":"Record edition manually","method_candidates":["GetProductName"],"notes":["Parent object unavailable; retry with an open sandbox/current Project."],"object_name":"resolve","observed_methods":[],"return_kind":null,"status":"PROBE_REQUIRED","studio_requirement":"UNCONFIRMED"},{"area":"PROJECT","capability_id":"project_manager.access","elapsed_ms":null,"error_code":null,"error_type":null,"fallback":"Manual Project selection","method_candidates":["GetProjectManager"],"notes":["Parent object unavailable; retry with an open sandbox/current Project."],"object_name":"resolve","observed_methods":[],"return_kind":null,"status":"PROBE_REQUIRED","studio_requirement":"UNCONFIRMED"},{"area":"PROJECT","capability_id":"project.current","elapsed_ms":null,"error_code":null,"error_type":null,"fallback":"Manual Project selection","method_candidates":["GetCurrentProject"],"notes":["Parent object unavailable; retry with an open sandbox/current Project."],"object_name":"project_manager","observed_methods":[],"return_kind":null,"status":"PROBE_REQUIRED","studio_requirement":"UNCONFIRMED"},{"area":"PROJECT","capability_id":"project.create","elapsed_ms":null,"error_code":null,"error_type":null,"fallback":"Create Project manually","method_candidates":["CreateProject"],"notes":["Parent object unavailable in this run."],"object_name":"project_manager","observed_methods":[],"return_kind":null,"status":"PROBE_REQUIRED","studio_requirement":"UNCONFIRMED"},{"area":"PROJECT","capability_id":"project.open","elapsed_ms":null,"error_code":null,"error_type":null,"fallback":"Open Project manually","method_candidates":["LoadProject"],"notes":["Parent object unavailable in this run."],"object_name":"project_manager","observed_methods":[],"return_kind":null,"status":"PROBE_REQUIRED","studio_requirement":"UNCONFIRMED"},{"area":"PROJECT","capability_id":"project.save","elapsed_ms":null,"error_code":null,"error_type":null,"fallback":"Save Project manually","method_candidates":["SaveProject"],"notes":["Parent object unavailable in this run."],"object_name":"project_manager","observed_methods":[],"return_kind":null,"status":"PROBE_REQUIRED","studio_requirement":"UNCONFIRMED"},{"area":"PROJECT","capability_id":"project.snapshot","elapsed_ms":null,"error_code":null,"error_type":null,"fallback":"Export/backup Project manually","method_candidates":["ExportProject"],"notes":["Parent object unavailable in this run."],"object_name":"project_manager","observed_methods":[],"return_kind":null,"status":"PROBE_REQUIRED","studio_requirement":"UNCONFIRMED"},{"area":"MEDIA","capability_id":"media_pool.access","elapsed_ms":null,"error_code":null,"error_type":null,"fallback":"Use Media page manually","method_candidates":["GetMediaPool"],"notes":["Parent object unavailable; retry with an open sandbox/current Project."],"object_name":"project","observed_methods":[],"return_kind":null,"status":"PROBE_REQUIRED","studio_requirement":"UNCONFIRMED"},{"area":"MEDIA","capability_id":"media.import","elapsed_ms":null,"error_code":null,"error_type":null,"fallback":"Import media manually","method_candidates":["ImportMedia"],"notes":["Parent object unavailable in this run."],"object_name":"media_pool","observed_methods":[],"return_kind":null,"status":"PROBE_REQUIRED","studio_requirement":"UNCONFIRMED"},{"area":"MEDIA","capability_id":"media.relink","elapsed_ms":null,"error_code":null,"error_type":null,"fallback":"Relink media manually","method_candidates":["RelinkClips"],"notes":["Parent object unavailable in this run."],"object_name":"media_pool","observed_methods":[],"return_kind":null,"status":"PROBE_REQUIRED","studio_requirement":"UNCONFIRMED"},{"area":"MEDIA","capability_id":"bin.ensure","elapsed_ms":null,"error_code":null,"error_type":null,"fallback":"Create bins manually","method_candidates":["AddSubFolder"],"notes":["Parent object unavailable in this run."],"object_name":"media_pool","observed_methods":[],"return_kind":null,"status":"PROBE_REQUIRED","studio_requirement":"UNCONFIRMED"},{"area":"TIMELINE","capability_id":"timeline.current","elapsed_ms":null,"error_code":null,"error_type":null,"fallback":"Select Timeline manually","method_candidates":["GetCurrentTimeline"],"notes":["Parent object unavailable; retry with an open sandbox/current Project."],"object_name":"project","observed_methods":[],"return_kind":null,"status":"PROBE_REQUIRED","studio_requirement":"UNCONFIRMED"},{"area":"TIMELINE","capability_id":"timeline.create","elapsed_ms":null,"error_code":null,"error_type":null,"fallback":"Create Timeline manually","method_candidates":["CreateEmptyTimeline","CreateTimelineFromClips"],"notes":["Parent object unavailable in this run."],"object_name":"media_pool","observed_methods":[],"return_kind":null,"status":"PROBE_REQUIRED","studio_requirement":"UNCONFIRMED"},{"area":"TIMELINE","capability_id":"timeline.build","elapsed_ms":null,"error_code":null,"error_type":null,"fallback":"Place clips manually","method_candidates":["AppendToTimeline"],"notes":["Parent object unavailable in this run."],"object_name":"media_pool","observed_methods":[],"return_kind":null,"status":"PROBE_REQUIRED","studio_requirement":"UNCONFIRMED"},{"area":"TIMELINE","capability_id":"timeline.markers","elapsed_ms":null,"error_code":null,"error_type":null,"fallback":"Place review markers manually","method_candidates":["AddMarker"],"notes":["Parent object unavailable in this run."],"object_name":"timeline","observed_methods":[],"return_kind":null,"status":"PROBE_REQUIRED","studio_requirement":"UNCONFIRMED"},{"area":"TIMELINE","capability_id":"timeline.subtitles","elapsed_ms":null,"error_code":null,"error_type":null,"fallback":"Import SRT or add subtitles manually","method_candidates":["ImportIntoTimeline"],"notes":["Parent object unavailable in this run.","Product operation may require a version-specific path; method presence is not semantic proof."],"object_name":"timeline","observed_methods":[],"return_kind":null,"status":"PROBE_REQUIRED","studio_requirement":"UNCONFIRMED"},{"area":"RENDER","capability_id":"render.settings","elapsed_ms":null,"error_code":null,"error_type":null,"fallback":"Configure Deliver page manually","method_candidates":["SetRenderSettings"],"notes":["Parent object unavailable in this run."],"object_name":"project","observed_methods":[],"return_kind":null,"status":"PROBE_REQUIRED","studio_requirement":"UNCONFIRMED"},{"area":"RENDER","capability_id":"render.submit","elapsed_ms":null,"error_code":null,"error_type":null,"fallback":"Add Render Queue job manually","method_candidates":["AddRenderJob"],"notes":["Parent object unavailable in this run."],"object_name":"project","observed_methods":[],"return_kind":null,"status":"PROBE_REQUIRED","studio_requirement":"UNCONFIRMED"},{"area":"RENDER","capability_id":"render.start","elapsed_ms":null,"error_code":null,"error_type":null,"fallback":"Start render manually","method_candidates":["StartRendering"],"notes":["Parent object unavailable in this run."],"object_name":"project","observed_methods":[],"return_kind":null,"status":"PROBE_REQUIRED","studio_requirement":"UNCONFIRMED"},{"area":"RENDER","capability_id":"render.status","elapsed_ms":null,"error_code":null,"error_type":null,"fallback":"Inspect Render Queue manually","method_candidates":["GetRenderJobStatus","IsRenderingInProgress"],"notes":["Parent object unavailable in this run."],"object_name":"project","observed_methods":[],"return_kind":null,"status":"PROBE_REQUIRED","studio_requirement":"UNCONFIRMED"},{"area":"RENDER","capability_id":"render.cancel","elapsed_ms":null,"error_code":null,"error_type":null,"fallback":"Cancel render manually","method_candidates":["StopRendering"],"notes":["Parent object unavailable in this run."],"object_name":"project","observed_methods":[],"return_kind":null,"status":"PROBE_REQUIRED","studio_requirement":"UNCONFIRMED"}],"connection_error":{"category":"EXTERNAL_DEPENDENCY","code":"ERR_RESOLVE_SCRIPT_MODULE_NOT_FOUND","details":{"platform":"Linux"},"message":"DaVinci Resolve scripting module could not be discovered locally","retryable":false},"created_at":"2026-08-08T16:08:35.868Z","host":{"machine":"x86_64","platform":"Linux","platform_release":"6.18.35","python_version":"3.13.5"},"mode":"READ_ONLY","probe_id":"EVD-01KZH248RW2369NJACX538CERQ","resolve":{"connected":false,"module_source_kind":"NOT_FOUND","product_name":null,"version":null},"schema_version":"1.0.0","summary":{"limited":0,"live_resolve_connected":false,"mutation_probe_executed":false,"probe_required":23,"supported":0,"unsupported":0}}
