{"capabilities":[{"area":"HEALTH","capability_id":"resolve.connection","elapsed_ms":null,"error_code":null,"error_type":null,"fallback":"Manual Resolve launch/check","method_candidates":[],"notes":["Resolve scripting root object obtained."],"object_name":"resolve","observed_methods":[],"return_kind":"OBJECT","status":"SUPPORTED","studio_requirement":"UNCONFIRMED"},{"area":"HEALTH","capability_id":"resolve.version","elapsed_ms":0.227,"error_code":null,"error_type":null,"fallback":"Record version manually","method_candidates":["GetVersionString","GetVersion"],"notes":[],"object_name":"resolve","observed_methods":["GetVersionString","GetVersion"],"return_kind":"STRING","status":"SUPPORTED","studio_requirement":"UNCONFIRMED"},{"area":"HEALTH","capability_id":"resolve.product_name","elapsed_ms":0.331,"error_code":null,"error_type":null,"fallback":"Record edition manually","method_candidates":["GetProductName"],"notes":[],"object_name":"resolve","observed_methods":["GetProductName"],"return_kind":"STRING","status":"SUPPORTED","studio_requirement":"UNCONFIRMED"},{"area":"PROJECT","capability_id":"project_manager.access","elapsed_ms":0.158,"error_code":null,"error_type":null,"fallback":"Manual Project selection","method_candidates":["GetProjectManager"],"notes":[],"object_name":"resolve","observed_methods":["GetProjectManager"],"return_kind":"OBJECT","status":"SUPPORTED","studio_requirement":"UNCONFIRMED"},{"area":"PROJECT","capability_id":"project.current","elapsed_ms":0.206,"error_code":null,"error_type":null,"fallback":"Manual Project selection","method_candidates":["GetCurrentProject"],"notes":[],"object_name":"project_manager","observed_methods":["GetCurrentProject"],"return_kind":"OBJECT","status":"SUPPORTED","studio_requirement":"UNCONFIRMED"},{"area":"PROJECT","capability_id":"project.create","elapsed_ms":null,"error_code":null,"error_type":null,"fallback":"Create Project manually","method_candidates":["CreateProject"],"notes":["Mutating/behavioral capability is method-present but not executed in read-only mode."],"object_name":"project_manager","observed_methods":["CreateProject"],"return_kind":null,"status":"PROBE_REQUIRED","studio_requirement":"UNCONFIRMED"},{"area":"PROJECT","capability_id":"project.open","elapsed_ms":null,"error_code":null,"error_type":null,"fallback":"Open Project manually","method_candidates":["LoadProject"],"notes":["Mutating/behavioral capability is method-present but not executed in read-only mode."],"object_name":"project_manager","observed_methods":["LoadProject"],"return_kind":null,"status":"PROBE_REQUIRED","studio_requirement":"UNCONFIRMED"},{"area":"PROJECT","capability_id":"project.save","elapsed_ms":null,"error_code":null,"error_type":null,"fallback":"Save Project manually","method_candidates":["SaveProject"],"notes":["Mutating/behavioral capability is method-present but not executed in read-only mode."],"object_name":"project_manager","observed_methods":["SaveProject"],"return_kind":null,"status":"PROBE_REQUIRED","studio_requirement":"UNCONFIRMED"},{"area":"PROJECT","capability_id":"project.snapshot","elapsed_ms":null,"error_code":null,"error_type":null,"fallback":"Export/backup Project manually","method_candidates":["ExportProject"],"notes":["Mutating/behavioral capability is method-present but not executed in read-only mode."],"object_name":"project_manager","observed_methods":["ExportProject"],"return_kind":null,"status":"PROBE_REQUIRED","studio_requirement":"UNCONFIRMED"},{"area":"MEDIA","capability_id":"media_pool.access","elapsed_ms":0.407,"error_code":null,"error_type":null,"fallback":"Use Media page manually","method_candidates":["GetMediaPool"],"notes":[],"object_name":"project","observed_methods":["GetMediaPool"],"return_kind":"OBJECT","status":"SUPPORTED","studio_requirement":"UNCONFIRMED"},{"area":"MEDIA","capability_id":"media.import","elapsed_ms":null,"error_code":null,"error_type":null,"fallback":"Import media manually","method_candidates":["ImportMedia"],"notes":["Mutating/behavioral capability is method-present but not executed in read-only mode."],"object_name":"media_pool","observed_methods":["ImportMedia"],"return_kind":null,"status":"PROBE_REQUIRED","studio_requirement":"UNCONFIRMED"},{"area":"MEDIA","capability_id":"media.relink","elapsed_ms":null,"error_code":null,"error_type":null,"fallback":"Relink media manually","method_candidates":["RelinkClips"],"notes":["Mutating/behavioral capability is method-present but not executed in read-only mode."],"object_name":"media_pool","observed_methods":["RelinkClips"],"return_kind":null,"status":"PROBE_REQUIRED","studio_requirement":"UNCONFIRMED"},{"area":"MEDIA","capability_id":"bin.ensure","elapsed_ms":null,"error_code":null,"error_type":null,"fallback":"Create bins manually","method_candidates":["AddSubFolder"],"notes":["Mutating/behavioral capability is method-present but not executed in read-only mode."],"object_name":"media_pool","observed_methods":["AddSubFolder"],"return_kind":null,"status":"PROBE_REQUIRED","studio_requirement":"UNCONFIRMED"},{"area":"TIMELINE","capability_id":"timeline.current","elapsed_ms":0.163,"error_code":null,"error_type":null,"fallback":"Select Timeline manually","method_candidates":["GetCurrentTimeline"],"notes":["None is a valid runtime state when no current Project/Timeline exists; method call itself succeeded."],"object_name":"project","observed_methods":["GetCurrentTimeline"],"return_kind":"NONE","status":"SUPPORTED","studio_requirement":"UNCONFIRMED"},{"area":"TIMELINE","capability_id":"timeline.create","elapsed_ms":null,"error_code":null,"error_type":null,"fallback":"Create Timeline manually","method_candidates":["CreateEmptyTimeline","CreateTimelineFromClips"],"notes":["Mutating/behavioral capability is method-present but not executed in read-only mode."],"object_name":"media_pool","observed_methods":["CreateEmptyTimeline","CreateTimelineFromClips"],"return_kind":null,"status":"PROBE_REQUIRED","studio_requirement":"UNCONFIRMED"},{"area":"TIMELINE","capability_id":"timeline.build","elapsed_ms":null,"error_code":null,"error_type":null,"fallback":"Place clips manually","method_candidates":["AppendToTimeline"],"notes":["Mutating/behavioral capability is method-present but not executed in read-only mode."],"object_name":"media_pool","observed_methods":["AppendToTimeline"],"return_kind":null,"status":"PROBE_REQUIRED","studio_requirement":"UNCONFIRMED"},{"area":"TIMELINE","capability_id":"timeline.markers","elapsed_ms":null,"error_code":null,"error_type":null,"fallback":"Place review markers manually","method_candidates":["AddMarker"],"notes":["Parent object unavailable in this run."],"object_name":"timeline","observed_methods":[],"return_kind":null,"status":"PROBE_REQUIRED","studio_requirement":"UNCONFIRMED"},{"area":"TIMELINE","capability_id":"timeline.subtitles","elapsed_ms":null,"error_code":null,"error_type":null,"fallback":"Import SRT or add subtitles manually","method_candidates":["ImportIntoTimeline"],"notes":["Parent object unavailable in this run.","Product operation may require a version-specific path; method presence is not semantic proof."],"object_name":"timeline","observed_methods":[],"return_kind":null,"status":"PROBE_REQUIRED","studio_requirement":"UNCONFIRMED"},{"area":"RENDER","capability_id":"render.settings","elapsed_ms":null,"error_code":null,"error_type":null,"fallback":"Configure Deliver page manually","method_candidates":["SetRenderSettings"],"notes":["Mutating/behavioral capability is method-present but not executed in read-only mode."],"object_name":"project","observed_methods":["SetRenderSettings"],"return_kind":null,"status":"PROBE_REQUIRED","studio_requirement":"UNCONFIRMED"},{"area":"RENDER","capability_id":"render.submit","elapsed_ms":null,"error_code":null,"error_type":null,"fallback":"Add Render Queue job manually","method_candidates":["AddRenderJob"],"notes":["Mutating/behavioral capability is method-present but not executed in read-only mode."],"object_name":"project","observed_methods":["AddRenderJob"],"return_kind":null,"status":"PROBE_REQUIRED","studio_requirement":"UNCONFIRMED"},{"area":"RENDER","capability_id":"render.start","elapsed_ms":null,"error_code":null,"error_type":null,"fallback":"Start render manually","method_candidates":["StartRendering"],"notes":["Mutating/behavioral capability is method-present but not executed in read-only mode."],"object_name":"project","observed_methods":["StartRendering"],"return_kind":null,"status":"PROBE_REQUIRED","studio_requirement":"UNCONFIRMED"},{"area":"RENDER","capability_id":"render.status","elapsed_ms":null,"error_code":null,"error_type":null,"fallback":"Inspect Render Queue manually","method_candidates":["GetRenderJobStatus","IsRenderingInProgress"],"notes":["Mutating/behavioral capability is method-present but not executed in read-only mode."],"object_name":"project","observed_methods":["GetRenderJobStatus","IsRenderingInProgress"],"return_kind":null,"status":"PROBE_REQUIRED","studio_requirement":"UNCONFIRMED"},{"area":"RENDER","capability_id":"render.cancel","elapsed_ms":null,"error_code":null,"error_type":null,"fallback":"Cancel render manually","method_candidates":["StopRendering"],"notes":["Mutating/behavioral capability is method-present but not executed in read-only mode."],"object_name":"project","observed_methods":["StopRendering"],"return_kind":null,"status":"PROBE_REQUIRED","studio_requirement":"UNCONFIRMED"}],"created_at":"2026-08-08T16:53:34.140Z","host":{"machine":"AMD64","platform":"Windows","platform_release":"11","python_version":"3.12.4"},"mode":"READ_ONLY","probe_id":"EVD-01KZH4PKSTFVENKVCACK8JEP0S","resolve":{"connected":true,"module_source_kind":"WINDOWS_PROGRAMDATA","product_name":"DaVinci Resolve Studio","version":"21.0.2.4"},"schema_version":"1.0.0","summary":{"limited":0,"live_resolve_connected":true,"mutation_probe_executed":false,"probe_required":16,"supported":7,"unsupported":0}}
