{"capabilities":[{"area":"HEALTH","capability_id":"resolve.connection","elapsed_ms":null,"error_code":null,"error_type":null,"fallback":"Manual Resolve launch/check","method_candidates":[],"notes":["Resolve scripting root object obtained."],"object_name":"resolve","observed_methods":[],"return_kind":"OBJECT","status":"SUPPORTED","studio_requirement":"UNCONFIRMED"},{"area":"HEALTH","capability_id":"resolve.version","elapsed_ms":0.26,"error_code":null,"error_type":null,"fallback":"Record version manually","method_candidates":["GetVersionString","GetVersion"],"notes":[],"object_name":"resolve","observed_methods":["GetVersionString","GetVersion"],"return_kind":"STRING","status":"SUPPORTED","studio_requirement":"UNCONFIRMED"},{"area":"HEALTH","capability_id":"resolve.product_name","elapsed_ms":0.142,"error_code":null,"error_type":null,"fallback":"Record edition manually","method_candidates":["GetProductName"],"notes":[],"object_name":"resolve","observed_methods":["GetProductName"],"return_kind":"STRING","status":"SUPPORTED","studio_requirement":"UNCONFIRMED"},{"area":"PROJECT","capability_id":"project_manager.access","elapsed_ms":0.193,"error_code":null,"error_type":null,"fallback":"Manual Project selection","method_candidates":["GetProjectManager"],"notes":[],"object_name":"resolve","observed_methods":["GetProjectManager"],"return_kind":"OBJECT","status":"SUPPORTED","studio_requirement":"UNCONFIRMED"},{"area":"PROJECT","capability_id":"project.current","elapsed_ms":0.16,"error_code":null,"error_type":null,"fallback":"Manual Project selection","method_candidates":["GetCurrentProject"],"notes":[],"object_name":"project_manager","observed_methods":["GetCurrentProject"],"return_kind":"OBJECT","status":"SUPPORTED","studio_requirement":"UNCONFIRMED"},{"area":"PROJECT","capability_id":"project.create","elapsed_ms":null,"error_code":null,"error_type":null,"fallback":"Create Project manually","method_candidates":["CreateProject"],"notes":["Existing sandbox Project was already current; creation was intentionally not repeated."],"object_name":"project_manager","observed_methods":["CreateProject"],"return_kind":"OBJECT","status":"LIMITED","studio_requirement":"UNCONFIRMED"},{"area":"PROJECT","capability_id":"project.open","elapsed_ms":0.221,"error_code":null,"error_type":null,"fallback":"Open Project manually","method_candidates":["LoadProject"],"notes":["Loaded the same isolated sandbox Project by name."],"object_name":"project_manager","observed_methods":["LoadProject"],"return_kind":"OBJECT","status":"SUPPORTED","studio_requirement":"UNCONFIRMED"},{"area":"PROJECT","capability_id":"project.save","elapsed_ms":14.534,"error_code":null,"error_type":null,"fallback":"Save Project manually","method_candidates":["SaveProject"],"notes":["Saved isolated sandbox Project."],"object_name":"project_manager","observed_methods":["SaveProject"],"return_kind":"BOOL","status":"SUPPORTED","studio_requirement":"UNCONFIRMED"},{"area":"PROJECT","capability_id":"project.snapshot","elapsed_ms":105.709,"error_code":null,"error_type":null,"fallback":"Export/backup Project manually","method_candidates":["ExportProject"],"notes":["ExportProject produced a non-empty temporary .drp snapshot."],"object_name":"project_manager","observed_methods":["ExportProject"],"return_kind":"BOOL","status":"SUPPORTED","studio_requirement":"UNCONFIRMED"},{"area":"MEDIA","capability_id":"media_pool.access","elapsed_ms":null,"error_code":null,"error_type":null,"fallback":"Use Media page manually","method_candidates":["GetMediaPool"],"notes":["Media Pool obtained from the isolated sandbox Project during behavioral probe."],"object_name":"project","observed_methods":["GetMediaPool"],"return_kind":"OBJECT","status":"SUPPORTED","studio_requirement":"UNCONFIRMED"},{"area":"MEDIA","capability_id":"media.import","elapsed_ms":46.661,"error_code":null,"error_type":null,"fallback":"Import media manually","method_candidates":["ImportMedia"],"notes":["Imported generated one-second silent WAV from a temporary probe directory."],"object_name":"media_pool","observed_methods":["ImportMedia"],"return_kind":"SEQUENCE","status":"SUPPORTED","studio_requirement":"UNCONFIRMED"},{"area":"MEDIA","capability_id":"media.relink","elapsed_ms":null,"error_code":null,"error_type":null,"fallback":"Relink media manually","method_candidates":["RelinkClips"],"notes":["Mutating/behavioral capability is method-present but not executed in read-only mode."],"object_name":"media_pool","observed_methods":["RelinkClips"],"return_kind":null,"status":"PROBE_REQUIRED","studio_requirement":"UNCONFIRMED"},{"area":"MEDIA","capability_id":"bin.ensure","elapsed_ms":3.879,"error_code":null,"error_type":null,"fallback":"Create bins manually","method_candidates":["AddSubFolder"],"notes":["Created isolated probe Bin."],"object_name":"media_pool","observed_methods":["AddSubFolder"],"return_kind":"OBJECT","status":"SUPPORTED","studio_requirement":"UNCONFIRMED"},{"area":"TIMELINE","capability_id":"timeline.current","elapsed_ms":null,"error_code":null,"error_type":null,"fallback":"Select Timeline manually","method_candidates":["GetCurrentTimeline"],"notes":["Current Timeline obtained after isolated sandbox Timeline creation."],"object_name":"project","observed_methods":["GetCurrentTimeline"],"return_kind":"OBJECT","status":"SUPPORTED","studio_requirement":"UNCONFIRMED"},{"area":"TIMELINE","capability_id":"timeline.create","elapsed_ms":1258.703,"error_code":null,"error_type":null,"fallback":"Create Timeline manually","method_candidates":["CreateEmptyTimeline","CreateTimelineFromClips"],"notes":["Created isolated probe Timeline."],"object_name":"media_pool","observed_methods":["CreateEmptyTimeline","CreateTimelineFromClips"],"return_kind":"OBJECT","status":"SUPPORTED","studio_requirement":"UNCONFIRMED"},{"area":"TIMELINE","capability_id":"timeline.build","elapsed_ms":412.712,"error_code":null,"error_type":null,"fallback":"Place clips manually","method_candidates":["AppendToTimeline"],"notes":["Appended imported probe media to isolated Timeline."],"object_name":"media_pool","observed_methods":["AppendToTimeline"],"return_kind":"SEQUENCE","status":"SUPPORTED","studio_requirement":"UNCONFIRMED"},{"area":"TIMELINE","capability_id":"timeline.markers","elapsed_ms":8.74,"error_code":null,"error_type":null,"fallback":"Place review markers manually","method_candidates":["AddMarker"],"notes":["Added marker at the sandbox Timeline start frame."],"object_name":"timeline","observed_methods":[],"return_kind":"BOOL","status":"SUPPORTED","studio_requirement":"UNCONFIRMED"},{"area":"TIMELINE","capability_id":"timeline.subtitles","elapsed_ms":null,"error_code":null,"error_type":null,"fallback":"Import SRT or add subtitles manually","method_candidates":["ImportIntoTimeline"],"notes":["Parent object unavailable in this run.","Product operation may require a version-specific path; method presence is not semantic proof."],"object_name":"timeline","observed_methods":[],"return_kind":null,"status":"PROBE_REQUIRED","studio_requirement":"UNCONFIRMED"},{"area":"RENDER","capability_id":"render.settings","elapsed_ms":null,"error_code":null,"error_type":null,"fallback":"Configure Deliver page manually","method_candidates":["SetRenderSettings"],"notes":["Mutating/behavioral capability is method-present but not executed in read-only mode."],"object_name":"project","observed_methods":["SetRenderSettings"],"return_kind":null,"status":"PROBE_REQUIRED","studio_requirement":"UNCONFIRMED"},{"area":"RENDER","capability_id":"render.submit","elapsed_ms":null,"error_code":null,"error_type":null,"fallback":"Add Render Queue job manually","method_candidates":["AddRenderJob"],"notes":["Mutating/behavioral capability is method-present but not executed in read-only mode."],"object_name":"project","observed_methods":["AddRenderJob"],"return_kind":null,"status":"PROBE_REQUIRED","studio_requirement":"UNCONFIRMED"},{"area":"RENDER","capability_id":"render.start","elapsed_ms":null,"error_code":null,"error_type":null,"fallback":"Start render manually","method_candidates":["StartRendering"],"notes":["Mutating/behavioral capability is method-present but not executed in read-only mode."],"object_name":"project","observed_methods":["StartRendering"],"return_kind":null,"status":"PROBE_REQUIRED","studio_requirement":"UNCONFIRMED"},{"area":"RENDER","capability_id":"render.status","elapsed_ms":null,"error_code":null,"error_type":null,"fallback":"Inspect Render Queue manually","method_candidates":["GetRenderJobStatus","IsRenderingInProgress"],"notes":["Mutating/behavioral capability is method-present but not executed in read-only mode."],"object_name":"project","observed_methods":["GetRenderJobStatus","IsRenderingInProgress"],"return_kind":null,"status":"PROBE_REQUIRED","studio_requirement":"UNCONFIRMED"},{"area":"RENDER","capability_id":"render.cancel","elapsed_ms":null,"error_code":null,"error_type":null,"fallback":"Cancel render manually","method_candidates":["StopRendering"],"notes":["Mutating/behavioral capability is method-present but not executed in read-only mode."],"object_name":"project","observed_methods":["StopRendering"],"return_kind":null,"status":"PROBE_REQUIRED","studio_requirement":"UNCONFIRMED"}],"created_at":"2026-08-08T18:13:10.814Z","host":{"machine":"AMD64","platform":"Windows","platform_release":"11","python_version":"3.12.4"},"mode":"SANDBOX_MUTATION","mutation_gate":{"authorized":true,"executed":true,"note":"Minimal TASK-002 sandbox sequence executed. Project deletion, render start/cancel, Resolve termination, relink and subtitle mutation were not requested.","sandbox_project":"BAI_CAPABILITY_PROBE_MANUAL"},"probe_id":"EVD-01KZH98CGYGQYP3QPZ9NWJ0DK4","resolve":{"connected":true,"module_source_kind":"WINDOWS_PROGRAMDATA","product_name":"DaVinci Resolve Studio","version":"21.0.2.4"},"schema_version":"1.0.0","summary":{"limited":1,"live_resolve_connected":true,"mutation_probe_executed":true,"probe_required":7,"supported":15,"unsupported":0}}
